<?xml version="1.0" encoding="UTF-8"?>
<dataroot xmlns:od="urn:schemas-microsoft-com:officedata" xmlns:xsi="http://www.w3.org/2001/XMLSchema-instance"  xsi:noNamespaceSchemaLocation="models_unit.xsd" generated="2007-02-15T10:10:48">
<models_unit>
<key>euro_guard_infantry</key>
</models_unit>
<models_unit>
<key>guard_infantry</key>
</models_unit>
<models_unit>
<key>gun_crew_2</key>
</models_unit>
<models_unit>
<key>line_infantry_2</key>
</models_unit>
<models_unit>
<key>model_british_middle_line_infantry</key>
</models_unit>
<models_unit>
<key>officer_artillery_2</key>
</models_unit>
<models_unit>
<key>officer_guard</key>
</models_unit>
<models_unit>
<key>officer_horse_light_1</key>
</models_unit>
<models_unit>
<key>officer_line_infantry_2</key>
</models_unit>
</dataroot>
